{
  "scenario_contract_version": "scenario-spec.v1",
  "scenario_id": "SCHEMA-SCENARIO-P0-05",
  "scenario_version": "1.0.0",
  "synthetic_only": true,
  "factory_profile": {
    "profile_id": "SCHEMA-PROFILE-P0-05",
    "profile_version": "1.0.0"
  },
  "generator": {
    "generator_id": "P0-EMPTY-IMPORT-GENERATOR",
    "generator_version": "1.0.0"
  },
  "seed": 20260819,
  "required_capabilities": [
    "DAG_ROUTING",
    "MACHINE_CALENDAR"
  ],
  "complexity": {
    "factory_size": "XS",
    "routing_complexity": "low",
    "candidate_resource_density": "sparse",
    "bottleneck_level": "low",
    "due_date_pressure": "low",
    "calendar_fragmentation": "low",
    "material_delay_ratio": 0,
    "wip_ratio": 0,
    "lock_ratio": 0,
    "cross_workshop_ratio": 0,
    "failure_frequency": "none"
  },
  "expected_behavior": {
    "allowed_results": [
      "FEASIBLE",
      "OPTIMAL"
    ],
    "validator_status": "PASS"
  }
}
